{
  "id": "qt-creator",
  "name": "Qt Creator",
  "category": "development",
  "subcategory": "ide",
  "match": [
    {
      "processName": "qtcreator"
    }
  ],
  "presence": {
    "largeImage": "https://raw.githubusercontent.com/the-real-l1near/DiscordPresence-AppDatabase/main/assets/qt-creator.png"
  }
}
