{
  "id": "wireshark",
  "name": "Wireshark",
  "category": "development",
  "subcategory": "network-tool",
  "match": [
    {
      "processName": "Wireshark"
    }
  ],
  "presence": {
    "largeImage": "https://raw.githubusercontent.com/the-real-l1near/DiscordPresence-AppDatabase/main/assets/wireshark.png"
  }
}
