{
  "id": "pgadmin",
  "name": "pgAdmin 4",
  "category": "development",
  "subcategory": "database",
  "match": [
    {
      "processName": "pgAdmin4"
    }
  ],
  "presence": {
    "largeImage": "https://raw.githubusercontent.com/the-real-l1near/DiscordPresence-AppDatabase/main/assets/pgadmin.png"
  }
}
