{
  "id": "krita",
  "name": "Krita",
  "category": "creative",
  "subcategory": "digital-painting",
  "match": [
    {
      "processName": "krita",
      "productName": "Krita",
      "originalFilename": "krita.exe"
    }
  ],
  "presence": {
    "largeImage": "https://raw.githubusercontent.com/the-real-l1near/DiscordPresence-AppDatabase/main/assets/krita.png"
  }
}
