{
  "id": "sublime-text",
  "name": "Sublime Text",
  "category": "development",
  "subcategory": "code-editor",
  "match": [
    {
      "processName": "sublime_text"
    }
  ],
  "presence": {
    "largeImage": "https://raw.githubusercontent.com/the-real-l1near/DiscordPresence-AppDatabase/main/assets/sublime-text.png"
  }
}
