{
  "id": "alacritty",
  "name": "Alacritty",
  "category": "development",
  "subcategory": "terminal",
  "match": [
    {
      "processName": "alacritty"
    }
  ],
  "presence": {
    "largeImage": "https://raw.githubusercontent.com/the-real-l1near/DiscordPresence-AppDatabase/main/assets/alacritty.png"
  }
}
