{
  "id": "datagrip",
  "name": "DataGrip",
  "category": "development",
  "subcategory": "database",
  "match": [
    {
      "processName": "datagrip64"
    }
  ],
  "presence": {
    "largeImage": "https://raw.githubusercontent.com/the-real-l1near/DiscordPresence-AppDatabase/main/assets/datagrip.png"
  }
}
