{
  "id": "kdenlive",
  "name": "Kdenlive",
  "category": "creative",
  "subcategory": "video-editing",
  "match": [
    {
      "processName": "kdenlive"
    }
  ],
  "presence": {
    "largeImage": "https://raw.githubusercontent.com/the-real-l1near/DiscordPresence-AppDatabase/main/assets/kdenlive.png"
  }
}
